{
  "schema_version": 1,
  "attestation_id": "rva-e44578decc129f98",
  "bundle_id": "rvb-a0734522693a92b6",
  "bundle_digest": "sha256:a0734522693a92b6f3ded831d2dd93ec9db6a243778d93c9902afcf0d12ee13a",
  "reviewer": "agent:codex-v6-dependency-review-20260928",
  "decision": "approved",
  "criteria": [
    {
      "id": "backend-concurrency",
      "disposition": "passed",
      "evidence": "integration:pose-mcp/go/review-bundle-convergence"
    },
    {
      "id": "backend-contracts",
      "disposition": "passed",
      "evidence": "integration:pose-mcp/go/review-bundle-convergence"
    },
    {
      "id": "backend-input-errors",
      "disposition": "passed",
      "evidence": "integration:pose-mcp/go/review-bundle-convergence"
    },
    {
      "id": "backend-integration-impact",
      "disposition": "passed",
      "evidence": "integration:pose-mcp/go/review-bundle-convergence"
    },
    {
      "id": "backend-observability",
      "disposition": "passed",
      "evidence": "integration:pose-mcp/go/review-bundle-convergence"
    },
    {
      "id": "compatibility",
      "disposition": "passed",
      "evidence": "integration:pose-mcp/go/review-bundle-convergence",
      "rationale": "Inspected CLI, MCP, file schemas and adoption boundaries; unknown obligations are refused, frozen historical inputs remain auditable, and experimental overlays remain opt-in."
    },
    {
      "id": "correctness",
      "disposition": "passed",
      "evidence": "integration:pose-mcp/go/review-bundle-convergence"
    },
    {
      "id": "documentation",
      "disposition": "passed",
      "evidence": "integration:pose-mcp/go/review-bundle-convergence",
      "rationale": "Inspected the canonical spec, CLI reference, applicable skills and embedded manual; explicit pending judgments and the implemented contract are consistent. Portuguese auto-approval guidance was corrected in the residual spec."
    },
    {
      "id": "operability",
      "disposition": "passed",
      "evidence": "integration:pose-mcp/go/review-bundle-convergence",
      "rationale": "Inspected bounded errors, freshness and unavailable states; diagnostics identify the next required action without converting unknown evidence into approval. No causal or telemetry benefit is inferred."
    },
    {
      "id": "requirements",
      "disposition": "passed",
      "evidence": "integration:pose-mcp/go/review-bundle-convergence"
    },
    {
      "id": "scope",
      "disposition": "passed",
      "evidence": "integration:pose-mcp/go/review-bundle-convergence",
      "rationale": "Compared attributed implementation and structural observation with the canonical source requirements; changes stay within the declared contract and separately tracked integrity residuals."
    },
    {
      "id": "security",
      "disposition": "passed",
      "evidence": "integration:pose-mcp/go/review-bundle-convergence",
      "rationale": "Inspected confinement, immutable evidence, identity and authority checks; missing support cannot authorize writes or approve findings. Critical wont-fix and negative-decision reuse bypasses are fixed and covered by Store, CLI and signed-import tests."
    }
  ],
  "tools": [
    {
      "id": "artifact-check",
      "disposition": "passed",
      "evidence": "report:.pose/reports/2026-09-28-abm-dependency-review.md",
      "rationale": "Executed required gates and inspected the current source evidence; conclusions and limits are recorded in the source review report."
    },
    {
      "id": "assess-design",
      "disposition": "passed",
      "evidence": "structure:design-afca51dcc2fe7574",
      "rationale": "Executed required gates and inspected the current source evidence; conclusions and limits are recorded in the source review report."
    },
    {
      "id": "assess-discover",
      "component": "pose-mcp",
      "disposition": "passed",
      "evidence": "report:.pose/reports/2026-09-28-abm-dependency-review.md",
      "rationale": "Executed required gates and inspected the current source evidence; conclusions and limits are recorded in the source review report."
    },
    {
      "id": "assess-integrate",
      "disposition": "passed",
      "evidence": "integration:pose-mcp/go/review-bundle-convergence",
      "rationale": "Executed required gates and inspected the current source evidence; conclusions and limits are recorded in the source review report."
    },
    {
      "id": "assess-tech-debt",
      "disposition": "passed",
      "evidence": "report:.pose/reports/2026-09-28-abm-dependency-review.md",
      "rationale": "Executed required gates and inspected the current source evidence; conclusions and limits are recorded in the source review report."
    },
    {
      "id": "closeout-check",
      "disposition": "deferred",
      "rationale": "post-review gate"
    },
    {
      "id": "review-check",
      "disposition": "deferred",
      "rationale": "post-review gate"
    },
    {
      "id": "suggest-review",
      "component": "pose-mcp",
      "disposition": "passed",
      "evidence": "report:.pose/reports/2026-09-28-abm-dependency-review.md",
      "rationale": "Executed required gates and inspected the current source evidence; conclusions and limits are recorded in the source review report."
    },
    {
      "id": "validate",
      "disposition": "passed",
      "evidence": "integration:pose-mcp/go/review-bundle-convergence",
      "rationale": "Executed required gates and inspected the current source evidence; conclusions and limits are recorded in the source review report."
    },
    {
      "id": "validate",
      "component": "pose-mcp",
      "disposition": "passed",
      "evidence": "integration:pose-mcp/go/review-bundle-convergence",
      "rationale": "Executed required gates and inspected the current source evidence; conclusions and limits are recorded in the source review report."
    }
  ],
  "evidence_refs": [
    "integration:pose-mcp/go/review-bundle-convergence",
    "structure:design-afca51dcc2fe7574"
  ],
  "findings": [],
  "attested_at": "2026-09-28T14:05:34Z",
  "path": ".pose/review-attestations/rva-e44578decc129f98.json"
}
