{
  "schema_version": 1,
  "attestation_id": "rva-f1234614bc4b270a",
  "bundle_id": "rvb-f2b2704c6ac5dd63",
  "bundle_digest": "sha256:f2b2704c6ac5dd630ba23137c88af20c463fe4350fcc9408889d3ff560768f26",
  "reviewer": "agent:claude-opus-5-5",
  "decision": "approved",
  "criteria": [
    {
      "id": "backend-concurrency",
      "disposition": "passed",
      "evidence": "unit:pose-mcp/go/test"
    },
    {
      "id": "backend-contracts",
      "disposition": "passed",
      "evidence": "integration:pose-mcp/go/review-bundle-convergence"
    },
    {
      "id": "backend-input-errors",
      "disposition": "passed",
      "evidence": "unit:pose-mcp/go/test"
    },
    {
      "id": "backend-integration-impact",
      "disposition": "passed",
      "evidence": "integration:pose-mcp/go/review-bundle-convergence"
    },
    {
      "id": "backend-observability",
      "disposition": "passed",
      "evidence": "unit:pose-mcp/go/test"
    },
    {
      "id": "compatibility",
      "disposition": "passed",
      "evidence": "structure:design-b97d10271aeec8f5",
      "rationale": "Bundles without gates read as reservations refused and no severity accepted, as before."
    },
    {
      "id": "correctness",
      "disposition": "passed",
      "evidence": "unit:pose-mcp/go/test"
    },
    {
      "id": "documentation",
      "disposition": "passed",
      "evidence": "structure:design-b97d10271aeec8f5",
      "rationale": "Refusals name the incomplete field or unknown disposition."
    },
    {
      "id": "operability",
      "disposition": "passed",
      "evidence": "structure:design-b97d10271aeec8f5",
      "rationale": "Incomplete findings are refused with the missing field named."
    },
    {
      "id": "requirements",
      "disposition": "passed",
      "evidence": "unit:pose-mcp/go/test",
      "rationale": "Tests the change set introduced and that pass in the sealed unit run: TestAnUnsealedGateIsTheConservativeReading, TestApprovedWithReservationsTakesTheSealedGate, TestBundlePathAcceptsACompleteAcceptedRisk, TestBundlePathRefusesTheFindingsTheLegacyPathAlwaysDid."
    },
    {
      "id": "scope",
      "disposition": "passed",
      "evidence": "structure:design-b97d10271aeec8f5",
      "rationale": "The bundle path enforces the finding and accepted-risk contract, reading severities and reservations from sealed gates."
    },
    {
      "id": "security",
      "disposition": "passed",
      "evidence": "structure:design-b97d10271aeec8f5",
      "rationale": "Gates come from the sealed bundle, not live policy."
    }
  ],
  "tools": [
    {
      "id": "artifact-check",
      "disposition": "passed",
      "evidence": "check:artifact-check",
      "rationale": "artifact-check --spec pose-bundle-findings-take-the-contract-the-legacy-path-had reports no error after the claims were reconciled on 2026-09-29."
    },
    {
      "id": "assess-design",
      "disposition": "not-used",
      "rationale": "not used during review"
    },
    {
      "id": "assess-discover",
      "component": "pose-mcp",
      "disposition": "not-used",
      "rationale": "not used during review"
    },
    {
      "id": "assess-integrate",
      "disposition": "not-used",
      "rationale": "not used during review"
    },
    {
      "id": "assess-tech-debt",
      "disposition": "not-used",
      "rationale": "not used during review"
    },
    {
      "id": "closeout-check",
      "disposition": "deferred",
      "rationale": "post-review gate"
    },
    {
      "id": "review-check",
      "disposition": "deferred",
      "rationale": "post-review gate"
    },
    {
      "id": "suggest-review",
      "component": "pose-mcp",
      "disposition": "not-used",
      "rationale": "not used during review"
    },
    {
      "id": "surface-check",
      "disposition": "passed",
      "evidence": "reachability:pose-mcp/go/delivery-reachability",
      "rationale": "surface-check --spec pose-bundle-findings-take-the-contract-the-legacy-path-had --strict reported 0 findings against these sealed results; the delivery reachability check passed in the same run."
    },
    {
      "id": "validate",
      "disposition": "passed",
      "evidence": "build:pose-mcp/go/build"
    },
    {
      "id": "validate",
      "component": "pose-mcp",
      "disposition": "passed",
      "evidence": "unit:pose-mcp/go/test",
      "rationale": "The sealed native matrix passed 43 of 43 at this revision."
    }
  ],
  "evidence_refs": [
    "unit:pose-mcp/go/test"
  ],
  "findings": [],
  "attested_at": "2026-09-29T21:12:44Z",
  "path": ".pose/review-attestations/rva-f1234614bc4b270a.json"
}
