{
  "schema_version": 1,
  "attestation_id": "rva-437b6019c8745ee3",
  "bundle_id": "rvb-cc60dfd0aa5e2b95",
  "bundle_digest": "sha256:cc60dfd0aa5e2b955bba6fda23c598cfa7c21aeaea4cb435da9efb59198498f5",
  "reviewer": "agent:codex-archive-dependency-renewal-20260928",
  "decision": "approved",
  "criteria": [
    {
      "id": "backend-concurrency",
      "disposition": "passed",
      "evidence": "unit:pose-mcp/go/test",
      "rationale": "No shared state added; the module suite passes, and transfer writers keep their root locks."
    },
    {
      "id": "backend-contracts",
      "disposition": "passed",
      "evidence": "integration:pose-mcp/go/spec-authority-transfer-integration",
      "rationale": "Other classifications are unchanged; transfer records join the governance prefixes and the lock stays out."
    },
    {
      "id": "backend-input-errors",
      "disposition": "passed",
      "evidence": "integration:pose-mcp/go/review-bundle-convergence",
      "rationale": "Malformed or unresolvable inputs keep failing with the existing stable codes; fail-closed paths are covered by the regressions."
    },
    {
      "id": "backend-integration-impact",
      "disposition": "passed",
      "evidence": "integration:pose-mcp/go/spec-authority-transfer-integration",
      "rationale": "Measured on a populated rehearsal of Harne8's seven ABM reconciliations before the change was committed."
    },
    {
      "id": "backend-observability",
      "disposition": "passed",
      "evidence": "integration:pose-mcp/go/spec-authority-transfer-integration",
      "rationale": "Blockers and outputs keep their existing shape; new states are named explicitly."
    },
    {
      "id": "compatibility",
      "disposition": "passed",
      "evidence": "integration:pose-mcp/go/spec-authority-transfer-integration",
      "rationale": "Existing plans, redirects and local-only milestones behave as before; no matrix or policy change. Reviewed the only delivered-path delta, the archive reader: alternate ownership requires the same immutable commit and its exact path diff, unique intact committed ledger and confinement. Existing authority, judgment and subject identity checks are preserved; current canonical 34-check matrix and archive negatives passed. Evidence is carried forward where the engine explicitly says so."
    },
    {
      "id": "correctness",
      "disposition": "passed",
      "evidence": "integration:pose-mcp/go/spec-authority-transfer-integration",
      "rationale": "The regression reports four misclassified records without the prefix; the Harne8 bundle goes from 43 unclassified paths to none."
    },
    {
      "id": "documentation",
      "disposition": "passed",
      "evidence": "structure:design-0690322da8a553a0",
      "rationale": "The spec records the rehearsal failure, the fix and the evidence. Reviewed the only delivered-path delta, the archive reader: alternate ownership requires the same immutable commit and its exact path diff, unique intact committed ledger and confinement. Existing authority, judgment and subject identity checks are preserved; current canonical 34-check matrix and archive negatives passed. Evidence is carried forward where the engine explicitly says so."
    },
    {
      "id": "operability",
      "disposition": "passed",
      "evidence": "integration:pose-mcp/go/spec-authority-transfer-integration",
      "rationale": "No new command or flag. Reviewed the only delivered-path delta, the archive reader: alternate ownership requires the same immutable commit and its exact path diff, unique intact committed ledger and confinement. Existing authority, judgment and subject identity checks are preserved; current canonical 34-check matrix and archive negatives passed. Evidence is carried forward where the engine explicitly says so."
    },
    {
      "id": "requirements",
      "disposition": "passed",
      "evidence": "integration:pose-mcp/go/spec-authority-transfer-integration",
      "rationale": "Every requirement is traced to a regression selected by a named matrix check."
    },
    {
      "id": "scope",
      "disposition": "passed",
      "evidence": "structure:design-0690322da8a553a0",
      "rationale": "The diff is limited to the files the spec declares. Reviewed the only delivered-path delta, the archive reader: alternate ownership requires the same immutable commit and its exact path diff, unique intact committed ledger and confinement. Existing authority, judgment and subject identity checks are preserved; current canonical 34-check matrix and archive negatives passed. Evidence is carried forward where the engine explicitly says so."
    },
    {
      "id": "security",
      "disposition": "passed",
      "evidence": "integration:pose-mcp/go/review-bundle-convergence",
      "rationale": "The classifier still refuses undeclared paths; the lock is never reviewed as an authority record. Reviewed the only delivered-path delta, the archive reader: alternate ownership requires the same immutable commit and its exact path diff, unique intact committed ledger and confinement. Existing authority, judgment and subject identity checks are preserved; current canonical 34-check matrix and archive negatives passed. Evidence is carried forward where the engine explicitly says so."
    }
  ],
  "tools": [
    {
      "id": "artifact-check",
      "disposition": "passed",
      "evidence": "artifact:pose-review-bundle-classifies-transfer-records",
      "rationale": "3 claims, 3 observed. Rechecked native attribution and the current canonical module evidence; the archive-reader change preserves this scope contract."
    },
    {
      "id": "assess-design",
      "disposition": "passed",
      "evidence": "structure:design-0690322da8a553a0",
      "rationale": "Design evidence sealed in the bundle. Rechecked native attribution and the current canonical module evidence; the archive-reader change preserves this scope contract."
    },
    {
      "id": "assess-discover",
      "component": "pose-mcp",
      "disposition": "not-used",
      "rationale": "not used during review"
    },
    {
      "id": "assess-integrate",
      "disposition": "passed",
      "evidence": "integration:pose-mcp/go/spec-authority-transfer-integration",
      "rationale": "No Protobuf, Kafka, REST or MCP tool contract changed. Rechecked native attribution and the current canonical module evidence; the archive-reader change preserves this scope contract."
    },
    {
      "id": "assess-tech-debt",
      "disposition": "passed",
      "evidence": "integration:pose-mcp/go/spec-authority-transfer-integration",
      "rationale": "The diff adds no debt markers. Rechecked native attribution and the current canonical module evidence; the archive-reader change preserves this scope contract."
    },
    {
      "id": "closeout-check",
      "disposition": "deferred",
      "rationale": "post-review gate"
    },
    {
      "id": "review-check",
      "disposition": "deferred",
      "rationale": "post-review gate"
    },
    {
      "id": "suggest-review",
      "component": "pose-mcp",
      "disposition": "not-used",
      "rationale": "not used during review"
    },
    {
      "id": "validate",
      "disposition": "passed",
      "evidence": "integration:pose-mcp/go/spec-authority-transfer-integration",
      "rationale": "Full matrix 29/29 at f6e6215. Rechecked native attribution and the current canonical module evidence; the archive-reader change preserves this scope contract."
    },
    {
      "id": "validate",
      "component": "pose-mcp",
      "disposition": "passed",
      "evidence": "unit:pose-mcp/go/test",
      "rationale": "go test ./... passed in the module. Rechecked native attribution and the current canonical module evidence; the archive-reader change preserves this scope contract."
    }
  ],
  "evidence_refs": [
    "integration:pose-mcp/go/release-review-archive-integration"
  ],
  "findings": [],
  "attested_at": "2026-09-29T00:32:30Z",
  "path": ".pose/review-attestations/rva-437b6019c8745ee3.json"
}
