{
  "schema_version": 1,
  "attestation_id": "rva-b588eb85184de6e6",
  "bundle_id": "rvb-aa240d9c3c9ef35a",
  "bundle_digest": "sha256:aa240d9c3c9ef35a03a68e6f1fb27fef986a9c661f3bed627d869b8d85a886e0",
  "reviewer": "agent:claude-code",
  "decision": "approved",
  "criteria": [
    {
      "id": "backend-concurrency",
      "disposition": "passed",
      "evidence": "integration:pose-mcp/go/delivery-integration"
    },
    {
      "id": "backend-contracts",
      "disposition": "passed",
      "evidence": "integration:pose-mcp/go/delivery-integration"
    },
    {
      "id": "backend-input-errors",
      "disposition": "passed",
      "evidence": "integration:pose-mcp/go/delivery-integration"
    },
    {
      "id": "backend-integration-impact",
      "disposition": "passed",
      "evidence": "integration:pose-mcp/go/delivery-integration"
    },
    {
      "id": "backend-observability",
      "disposition": "passed",
      "evidence": "integration:pose-mcp/go/delivery-integration"
    },
    {
      "id": "compatibility",
      "disposition": "passed",
      "evidence": "integration:pose-mcp/go/delivery-integration"
    },
    {
      "id": "correctness",
      "disposition": "passed",
      "evidence": "integration:pose-mcp/go/delivery-integration"
    },
    {
      "id": "documentation",
      "disposition": "passed",
      "evidence": "integration:pose-mcp/go/delivery-integration"
    },
    {
      "id": "operability",
      "disposition": "passed",
      "evidence": "integration:pose-mcp/go/delivery-integration"
    },
    {
      "id": "requirements",
      "disposition": "passed",
      "evidence": "integration:pose-mcp/go/delivery-integration"
    },
    {
      "id": "scope",
      "disposition": "passed",
      "evidence": "integration:pose-mcp/go/delivery-integration"
    },
    {
      "id": "security",
      "disposition": "passed",
      "evidence": "integration:pose-mcp/go/delivery-integration"
    }
  ],
  "tools": [
    {
      "id": "artifact-check",
      "disposition": "passed",
      "evidence": "integration:pose-mcp/go/delivery-integration"
    },
    {
      "id": "assess-discover",
      "component": "pose-mcp",
      "disposition": "not-used",
      "rationale": "not used during automated attestation"
    },
    {
      "id": "assess-integrate",
      "disposition": "not-used",
      "rationale": "not used during automated attestation"
    },
    {
      "id": "assess-tech-debt",
      "disposition": "not-used",
      "rationale": "not used during automated attestation"
    },
    {
      "id": "closeout-check",
      "disposition": "deferred",
      "rationale": "post-review gate"
    },
    {
      "id": "review-check",
      "disposition": "deferred",
      "rationale": "post-review gate"
    },
    {
      "id": "suggest-review",
      "component": "pose-mcp",
      "disposition": "not-used",
      "rationale": "not used during automated attestation"
    },
    {
      "id": "surface-check",
      "disposition": "passed",
      "evidence": "integration:pose-mcp/go/delivery-integration"
    },
    {
      "id": "validate",
      "disposition": "passed",
      "evidence": "validation:auto-attest"
    },
    {
      "id": "validate",
      "component": "pose-mcp",
      "disposition": "passed",
      "evidence": "validation:auto-attest"
    }
  ],
  "evidence_refs": [
    "integration:pose-mcp/go/delivery-integration",
    "integration:pose-mcp/go/review-bundle-convergence",
    "reachability:pose-mcp/go/delivery-reachability",
    "unit:pose-mcp/go/test"
  ],
  "findings": [],
  "attested_at": "2026-08-15T12:10:47Z",
  "path": ".pose/review-attestations/rva-b588eb85184de6e6.json"
}
