{
  "schema_version": 1,
  "attestation_id": "rva-2e084322af1f13b4",
  "bundle_id": "rvb-56cdd4150522a191",
  "bundle_digest": "sha256:56cdd4150522a191cf3f8f8f24986c912f6b4cf523aac9f25aecca35a538f867",
  "reviewer": "agent:codex-archive-dependency-renewal-20260928",
  "decision": "approved",
  "criteria": [
    {
      "id": "backend-concurrency",
      "disposition": "passed",
      "evidence": "integration:pose-mcp/go/review-bundle-convergence"
    },
    {
      "id": "backend-contracts",
      "disposition": "passed",
      "evidence": "integration:pose-mcp/go/review-bundle-convergence"
    },
    {
      "id": "backend-input-errors",
      "disposition": "passed",
      "evidence": "integration:pose-mcp/go/review-bundle-convergence"
    },
    {
      "id": "backend-integration-impact",
      "disposition": "passed",
      "evidence": "integration:pose-mcp/go/review-bundle-convergence"
    },
    {
      "id": "backend-observability",
      "disposition": "passed",
      "evidence": "integration:pose-mcp/go/review-bundle-convergence"
    },
    {
      "id": "compatibility",
      "disposition": "passed",
      "evidence": "integration:pose-mcp/go/review-bundle-convergence",
      "rationale": "Inspected CLI, MCP, file schemas and adoption boundaries; unknown obligations are refused, frozen historical inputs remain auditable, and experimental overlays remain opt-in. Reviewed the only delivered-path delta, the archive reader: alternate ownership requires the same immutable commit and its exact path diff, unique intact committed ledger and confinement. Existing authority, judgment and subject identity checks are preserved; current canonical 34-check matrix and archive negatives passed. Evidence is carried forward where the engine explicitly says so."
    },
    {
      "id": "correctness",
      "disposition": "passed",
      "evidence": "integration:pose-mcp/go/review-bundle-convergence"
    },
    {
      "id": "documentation",
      "disposition": "passed",
      "evidence": "integration:pose-mcp/go/review-bundle-convergence",
      "rationale": "Inspected the canonical spec, CLI reference, applicable skills and embedded manual; explicit pending judgments and the implemented contract are consistent. Portuguese auto-approval guidance was corrected in the residual spec. Reviewed the only delivered-path delta, the archive reader: alternate ownership requires the same immutable commit and its exact path diff, unique intact committed ledger and confinement. Existing authority, judgment and subject identity checks are preserved; current canonical 34-check matrix and archive negatives passed. Evidence is carried forward where the engine explicitly says so."
    },
    {
      "id": "operability",
      "disposition": "passed",
      "evidence": "integration:pose-mcp/go/review-bundle-convergence",
      "rationale": "Inspected bounded errors, freshness and unavailable states; diagnostics identify the next required action without converting unknown evidence into approval. No causal or telemetry benefit is inferred. Reviewed the only delivered-path delta, the archive reader: alternate ownership requires the same immutable commit and its exact path diff, unique intact committed ledger and confinement. Existing authority, judgment and subject identity checks are preserved; current canonical 34-check matrix and archive negatives passed. Evidence is carried forward where the engine explicitly says so."
    },
    {
      "id": "requirements",
      "disposition": "passed",
      "evidence": "integration:pose-mcp/go/review-bundle-convergence"
    },
    {
      "id": "scope",
      "disposition": "passed",
      "evidence": "integration:pose-mcp/go/review-bundle-convergence",
      "rationale": "Compared attributed implementation and structural observation with the canonical source requirements; changes stay within the declared contract and separately tracked integrity residuals. Reviewed the only delivered-path delta, the archive reader: alternate ownership requires the same immutable commit and its exact path diff, unique intact committed ledger and confinement. Existing authority, judgment and subject identity checks are preserved; current canonical 34-check matrix and archive negatives passed. Evidence is carried forward where the engine explicitly says so."
    },
    {
      "id": "security",
      "disposition": "passed",
      "evidence": "integration:pose-mcp/go/review-bundle-convergence",
      "rationale": "Inspected confinement, immutable evidence, identity and authority checks; missing support cannot authorize writes or approve findings. Critical wont-fix and negative-decision reuse bypasses are fixed and covered by Store, CLI and signed-import tests. Reviewed the only delivered-path delta, the archive reader: alternate ownership requires the same immutable commit and its exact path diff, unique intact committed ledger and confinement. Existing authority, judgment and subject identity checks are preserved; current canonical 34-check matrix and archive negatives passed. Evidence is carried forward where the engine explicitly says so."
    }
  ],
  "tools": [
    {
      "id": "artifact-check",
      "disposition": "passed",
      "evidence": "report:.pose/reports/2026-09-28-abm-dependency-review.md",
      "rationale": "Executed required gates and inspected the current source evidence; conclusions and limits are recorded in the source review report. Rechecked native attribution and the current canonical module evidence; the archive-reader change preserves this scope contract."
    },
    {
      "id": "assess-design",
      "disposition": "passed",
      "evidence": "structure:design-bb3897e772074c49",
      "rationale": "Executed required gates and inspected the current source evidence; conclusions and limits are recorded in the source review report. Rechecked native attribution and the current canonical module evidence; the archive-reader change preserves this scope contract."
    },
    {
      "id": "assess-discover",
      "component": "pose-mcp",
      "disposition": "passed",
      "evidence": "report:.pose/reports/2026-09-28-abm-dependency-review.md",
      "rationale": "Executed required gates and inspected the current source evidence; conclusions and limits are recorded in the source review report. Rechecked native attribution and the current canonical module evidence; the archive-reader change preserves this scope contract."
    },
    {
      "id": "assess-integrate",
      "disposition": "passed",
      "evidence": "integration:pose-mcp/go/review-bundle-convergence",
      "rationale": "Executed required gates and inspected the current source evidence; conclusions and limits are recorded in the source review report. Rechecked native attribution and the current canonical module evidence; the archive-reader change preserves this scope contract."
    },
    {
      "id": "assess-tech-debt",
      "disposition": "passed",
      "evidence": "report:.pose/reports/2026-09-28-abm-dependency-review.md",
      "rationale": "Executed required gates and inspected the current source evidence; conclusions and limits are recorded in the source review report. Rechecked native attribution and the current canonical module evidence; the archive-reader change preserves this scope contract."
    },
    {
      "id": "closeout-check",
      "disposition": "deferred",
      "rationale": "post-review gate"
    },
    {
      "id": "review-check",
      "disposition": "deferred",
      "rationale": "post-review gate"
    },
    {
      "id": "suggest-review",
      "component": "pose-mcp",
      "disposition": "passed",
      "evidence": "report:.pose/reports/2026-09-28-abm-dependency-review.md",
      "rationale": "Executed required gates and inspected the current source evidence; conclusions and limits are recorded in the source review report. Rechecked native attribution and the current canonical module evidence; the archive-reader change preserves this scope contract."
    },
    {
      "id": "validate",
      "disposition": "passed",
      "evidence": "integration:pose-mcp/go/review-bundle-convergence",
      "rationale": "Executed required gates and inspected the current source evidence; conclusions and limits are recorded in the source review report. Rechecked native attribution and the current canonical module evidence; the archive-reader change preserves this scope contract."
    },
    {
      "id": "validate",
      "component": "pose-mcp",
      "disposition": "passed",
      "evidence": "integration:pose-mcp/go/review-bundle-convergence",
      "rationale": "Executed required gates and inspected the current source evidence; conclusions and limits are recorded in the source review report. Rechecked native attribution and the current canonical module evidence; the archive-reader change preserves this scope contract."
    }
  ],
  "evidence_refs": [
    "integration:pose-mcp/go/release-review-archive-integration"
  ],
  "findings": [],
  "attested_at": "2026-09-29T00:32:17Z",
  "path": ".pose/review-attestations/rva-2e084322af1f13b4.json"
}
