{
  "schema_version": 1,
  "attestation_id": "rva-a828cecd22fdae09",
  "bundle_id": "rvb-7ec9179cd6f839b5",
  "bundle_digest": "sha256:7ec9179cd6f839b5f07538cde95779886a1d3aa513679e109179c5abaa47dba9",
  "reviewer": "agent:claude-opus-5-5",
  "decision": "approved",
  "criteria": [
    {
      "id": "cross-component-integration",
      "disposition": "passed",
      "evidence": "integration:pose-mcp/go/spec-authority-transfer-integration"
    },
    {
      "id": "exit-gate",
      "disposition": "passed",
      "evidence": "integration:pose-mcp/go/spec-authority-transfer-integration",
      "rationale": "Child review renewed after the instance adopted policy schema 4; transfer integration and negative checks pass on current evidence."
    },
    {
      "id": "integration",
      "disposition": "passed",
      "evidence": "integration:pose-mcp/go/spec-authority-transfer-integration"
    },
    {
      "id": "membership",
      "disposition": "passed",
      "evidence": "integration:pose-mcp/go/spec-authority-transfer-integration",
      "rationale": "Child review renewed after the instance adopted policy schema 4; transfer integration and negative checks pass on current evidence."
    },
    {
      "id": "regression",
      "disposition": "passed",
      "evidence": "integration:pose-mcp/go/spec-authority-transfer-integration",
      "rationale": "Child review renewed after the instance adopted policy schema 4; transfer integration and negative checks pass on current evidence."
    },
    {
      "id": "residual-risk",
      "disposition": "passed",
      "evidence": "integration:pose-mcp/go/spec-authority-transfer-integration",
      "rationale": "Child review renewed after the instance adopted policy schema 4; transfer integration and negative checks pass on current evidence."
    }
  ],
  "tools": [
    {
      "id": "assess-discover",
      "component": "docs-site",
      "disposition": "not-used",
      "rationale": "not used during review"
    },
    {
      "id": "assess-discover",
      "component": "pose-mcp",
      "disposition": "not-used",
      "rationale": "not used during review"
    },
    {
      "id": "assess-integrate",
      "disposition": "passed",
      "evidence": "integration:pose-mcp/go/spec-authority-transfer-integration",
      "rationale": "Integration assessment ran; inventory gaps predate the scope."
    },
    {
      "id": "assess-tech-debt",
      "disposition": "not-used",
      "rationale": "not used during review"
    },
    {
      "id": "closeout-check",
      "disposition": "deferred",
      "rationale": "post-review gate"
    },
    {
      "id": "review-check",
      "disposition": "deferred",
      "rationale": "post-review gate"
    },
    {
      "id": "suggest-review",
      "component": "docs-site",
      "disposition": "not-used",
      "rationale": "not used during review"
    },
    {
      "id": "suggest-review",
      "component": "pose-mcp",
      "disposition": "not-used",
      "rationale": "not used during review"
    },
    {
      "id": "validate",
      "component": "docs-site",
      "disposition": "not-used",
      "rationale": "No docs-site validation producer is registered."
    },
    {
      "id": "validate",
      "component": "pose-mcp",
      "disposition": "passed",
      "evidence": "integration:pose-mcp/go/spec-authority-transfer-integration",
      "rationale": "The full matrix passed 29 checks at the current revision."
    }
  ],
  "evidence_refs": [
    "integration:pose-mcp/go/spec-authority-transfer-integration"
  ],
  "findings": [],
  "attested_at": "2026-09-27T06:27:25Z",
  "path": ".pose/review-attestations/rva-a828cecd22fdae09.json"
}
