{
  "schema_version": 1,
  "attestation_id": "rva-f86d8707dd90ae4b",
  "bundle_id": "rvb-677c47132649a5b9",
  "bundle_digest": "sha256:677c47132649a5b933756488e49ce967d10e011f2bcf709da995741424734a76",
  "reviewer": "agent:claude-opus-5-5",
  "decision": "approved",
  "criteria": [
    {
      "id": "backend-concurrency",
      "disposition": "passed",
      "evidence": "unit:pose-mcp/go/test",
      "rationale": "No shared state added; the module suite passes, and transfer writers keep their root locks."
    },
    {
      "id": "backend-contracts",
      "disposition": "passed",
      "evidence": "integration:pose-mcp/go/federated-roadmap-acceptance-integration",
      "rationale": "Milestone members of another project are judged by federated acceptance; local members keep every check."
    },
    {
      "id": "backend-input-errors",
      "disposition": "passed",
      "evidence": "integration:pose-mcp/go/federated-roadmap-negative-gates",
      "rationale": "Malformed or unresolvable inputs keep failing with the existing stable codes; fail-closed paths are covered by the regressions."
    },
    {
      "id": "backend-integration-impact",
      "disposition": "passed",
      "evidence": "integration:pose-mcp/go/federated-roadmap-acceptance-integration",
      "rationale": "Measured on a populated rehearsal of Harne8's seven ABM reconciliations before the change was committed."
    },
    {
      "id": "backend-observability",
      "disposition": "passed",
      "evidence": "integration:pose-mcp/go/federated-roadmap-acceptance-integration",
      "rationale": "Blockers and outputs keep their existing shape; new states are named explicitly."
    },
    {
      "id": "compatibility",
      "disposition": "passed",
      "evidence": "integration:pose-mcp/go/federated-roadmap-acceptance-integration",
      "rationale": "Existing plans, redirects and local-only milestones behave as before; no matrix or policy change."
    },
    {
      "id": "correctness",
      "disposition": "passed",
      "evidence": "integration:pose-mcp/go/federated-roadmap-acceptance-integration",
      "rationale": "The regression failed on closeout, review plan and bundle in turn and passes with every reader routed through one helper."
    },
    {
      "id": "documentation",
      "disposition": "passed",
      "evidence": "structure:design-748c2a5e0b32b83c",
      "rationale": "The spec records the rehearsal failure, the fix and the evidence."
    },
    {
      "id": "operability",
      "disposition": "passed",
      "evidence": "integration:pose-mcp/go/federated-roadmap-acceptance-integration",
      "rationale": "No new command or flag."
    },
    {
      "id": "requirements",
      "disposition": "passed",
      "evidence": "integration:pose-mcp/go/federated-roadmap-acceptance-integration",
      "rationale": "Every requirement is traced to a regression selected by a named matrix check."
    },
    {
      "id": "scope",
      "disposition": "passed",
      "evidence": "structure:design-748c2a5e0b32b83c",
      "rationale": "The diff is limited to the files the spec declares."
    },
    {
      "id": "security",
      "disposition": "passed",
      "evidence": "integration:pose-mcp/go/federated-roadmap-negative-gates",
      "rationale": "An external member blocks when no federated resolver is configured, and revoked trust still blocks its milestone."
    }
  ],
  "tools": [
    {
      "id": "artifact-check",
      "disposition": "passed",
      "evidence": "artifact:pose-federated-external-milestone-members",
      "rationale": "6 claims, 6 observed."
    },
    {
      "id": "assess-design",
      "disposition": "passed",
      "evidence": "structure:design-748c2a5e0b32b83c",
      "rationale": "Design evidence sealed in the bundle."
    },
    {
      "id": "assess-discover",
      "component": "pose-mcp",
      "disposition": "not-used",
      "rationale": "not used during review"
    },
    {
      "id": "assess-integrate",
      "disposition": "passed",
      "evidence": "integration:pose-mcp/go/federated-roadmap-acceptance-integration",
      "rationale": "No Protobuf, Kafka, REST or MCP tool contract changed."
    },
    {
      "id": "assess-tech-debt",
      "disposition": "passed",
      "evidence": "integration:pose-mcp/go/federated-roadmap-acceptance-integration",
      "rationale": "The diff adds no debt markers."
    },
    {
      "id": "closeout-check",
      "disposition": "deferred",
      "rationale": "post-review gate"
    },
    {
      "id": "review-check",
      "disposition": "deferred",
      "rationale": "post-review gate"
    },
    {
      "id": "suggest-review",
      "component": "pose-mcp",
      "disposition": "not-used",
      "rationale": "not used during review"
    },
    {
      "id": "validate",
      "disposition": "passed",
      "evidence": "integration:pose-mcp/go/federated-roadmap-acceptance-integration",
      "rationale": "Full matrix 29/29 at eb143d6."
    },
    {
      "id": "validate",
      "component": "pose-mcp",
      "disposition": "passed",
      "evidence": "unit:pose-mcp/go/test",
      "rationale": "go test ./... passed in the module."
    }
  ],
  "evidence_refs": [
    "integration:pose-mcp/go/federated-roadmap-acceptance-integration"
  ],
  "findings": [],
  "attested_at": "2026-09-27T07:47:20Z",
  "path": ".pose/review-attestations/rva-f86d8707dd90ae4b.json"
}
