{
  "schema_version": 1,
  "attestation_id": "rva-f6e713fef3da96db",
  "bundle_id": "rvb-8a2b03355fcb2ff9",
  "bundle_digest": "sha256:8a2b03355fcb2ff9530c16b81d6e5e1ec29c830b72e96fd627fc17c26a3309de",
  "reviewer": "agent:claude-opus-5-5",
  "decision": "approved",
  "criteria": [
    {
      "id": "backend-concurrency",
      "disposition": "passed",
      "evidence": "integration:pose-mcp/go/abm-atomic-start-integration"
    },
    {
      "id": "backend-contracts",
      "disposition": "passed",
      "evidence": "integration:pose-mcp/go/abm-atomic-start-integration"
    },
    {
      "id": "backend-input-errors",
      "disposition": "passed",
      "evidence": "integration:pose-mcp/go/abm-atomic-start-integration"
    },
    {
      "id": "backend-integration-impact",
      "disposition": "passed",
      "evidence": "integration:pose-mcp/go/abm-atomic-start-integration"
    },
    {
      "id": "backend-observability",
      "disposition": "passed",
      "evidence": "integration:pose-mcp/go/abm-atomic-start-integration"
    },
    {
      "id": "compatibility",
      "disposition": "passed",
      "evidence": "structure:design-628f6fe6f0fb51db",
      "rationale": "No CLI or schema change; the round verified the published 7.1.0 artifacts through their package manifests on both native runners."
    },
    {
      "id": "correctness",
      "disposition": "passed",
      "evidence": "integration:pose-mcp/go/abm-atomic-start-integration"
    },
    {
      "id": "cross-component-integration",
      "disposition": "passed",
      "evidence": "integration:pose-mcp/go/abm-atomic-start-integration"
    },
    {
      "id": "documentation",
      "disposition": "passed",
      "evidence": "structure:design-628f6fe6f0fb51db",
      "rationale": "The execution log keeps the run, both job URLs, the tag, the commit and the checksums; known gaps and residual risks now name only later releases."
    },
    {
      "id": "operability",
      "disposition": "passed",
      "evidence": "structure:design-628f6fe6f0fb51db",
      "rationale": "Both native jobs installed 7.1.0 through Homebrew and WinGet, passed check --strict and doctor with 0 errors; the one doctor warning is the expected mcp.config with --skip-mcp. Full native run at the sealed head with the candidate CLI built from it: 131 of 131 steps pass."
    },
    {
      "id": "requirements",
      "disposition": "passed",
      "evidence": "integration:pose-mcp/go/abm-atomic-start-integration"
    },
    {
      "id": "scope",
      "disposition": "passed",
      "evidence": "structure:design-628f6fe6f0fb51db",
      "rationale": "Workflow wiring from 2026-10-01 plus the final round's evidence; no code changed on 2026-10-09. Reviewed in the same session that implemented it, with no separate reviewer execution: declared, not independent."
    },
    {
      "id": "security",
      "disposition": "passed",
      "evidence": "structure:design-628f6fe6f0fb51db",
      "rationale": "The workflow stays read-only with pinned actions and a validated tag input; WinGet verified the installer hash, and failures are not masked with continue-on-error."
    }
  ],
  "tools": [
    {
      "id": "artifact-check",
      "disposition": "passed",
      "evidence": "check:artifact-check",
      "rationale": "artifact-check --spec pose-package-channels-deferred-native-verification --strict with the candidate CLI exited 0."
    },
    {
      "id": "assess-design",
      "disposition": "passed",
      "evidence": "structure:design-628f6fe6f0fb51db",
      "rationale": "Structural delta observed in the sealed bundle."
    },
    {
      "id": "assess-discover",
      "component": "docs-site",
      "disposition": "not-used",
      "rationale": "not used during review"
    },
    {
      "id": "assess-discover",
      "component": "pose-mcp",
      "disposition": "not-used",
      "rationale": "not used during review"
    },
    {
      "id": "assess-integrate",
      "disposition": "passed",
      "evidence": "integration:pose-mcp/go/abm-atomic-start-integration",
      "rationale": "pose assess integrate ran with the candidate CLI and exited 0."
    },
    {
      "id": "assess-tech-debt",
      "disposition": "not-used",
      "rationale": "not used during review"
    },
    {
      "id": "closeout-check",
      "disposition": "deferred",
      "rationale": "post-review gate"
    },
    {
      "id": "history-check",
      "disposition": "passed",
      "evidence": "integration:pose-mcp/go/abm-atomic-start-integration",
      "rationale": "pose history-check --strict with the candidate CLI exited 0: history.staged_or_clean=107, history.modified_unstaged=0."
    },
    {
      "id": "review-check",
      "disposition": "deferred",
      "rationale": "post-review gate"
    },
    {
      "id": "suggest-review",
      "component": "docs-site",
      "disposition": "not-used",
      "rationale": "not used during review"
    },
    {
      "id": "suggest-review",
      "component": "pose-mcp",
      "disposition": "not-used",
      "rationale": "not used during review"
    },
    {
      "id": "validate",
      "disposition": "passed",
      "evidence": "unit:pose-mcp/go/test",
      "rationale": "Full native run at the sealed head with the candidate CLI built from it: 131 of 131 steps pass."
    },
    {
      "id": "validate",
      "component": "docs-site",
      "disposition": "not-used",
      "rationale": "The validation matrix declares no check for docs-site (producer_coverage none)."
    },
    {
      "id": "validate",
      "component": "pose-mcp",
      "disposition": "passed",
      "evidence": "unit:pose-mcp/go/test",
      "rationale": "Full native run at the sealed head with the candidate CLI built from it: 131 of 131 steps pass."
    }
  ],
  "evidence_refs": [
    "integration:pose-mcp/go/abm-atomic-start-integration",
    "structure:design-628f6fe6f0fb51db",
    "unit:pose-mcp/go/test"
  ],
  "findings": [],
  "attested_at": "2026-10-09T17:32:47Z",
  "path": ".pose/review-attestations/rva-f6e713fef3da96db.json"
}
